{
  "schemaVersion": 1,
  "phase": 5,
  "candidate": {
    "gitSha": "0000000000000000000000000000000000000000",
    "productVersion": "0.5.0-phase5",
    "finalReleaseManifest": {
      "path": "artifacts/phase5/formal/release/final-release-manifest.json",
      "sha256": "0000000000000000000000000000000000000000000000000000000000000000"
    },
    "cleanDownloadVerification": {
      "path": "artifacts/phase5/formal/clean-download/clean-download-verification.json",
      "sha256": "0000000000000000000000000000000000000000000000000000000000000000"
    },
    "artifactSetDigest": "0000000000000000000000000000000000000000000000000000000000000000"
  },
  "gates": [
    {
      "id": "G0-SCOPE-FREEZE",
      "evidenceClass": "REPOSITORY",
      "externalEvidence": false,
      "status": "PENDING",
      "evidence": {
        "path": "artifacts/phase5/formal/gates/G0-SCOPE-FREEZE.json",
        "sha256": null
      },
      "note": "Replace with the exact formal evidence path and digest; do not promote development smoke."
    },
    {
      "id": "G1-PHASE4-BASELINE",
      "evidenceClass": "REPOSITORY",
      "externalEvidence": false,
      "status": "PENDING",
      "evidence": {
        "path": "artifacts/phase5/formal/gates/G1-PHASE4-BASELINE.json",
        "sha256": null
      },
      "note": "Replace with the exact formal evidence path and digest; do not promote development smoke."
    },
    {
      "id": "G2-CLEAN-SOURCE",
      "evidenceClass": "REPOSITORY",
      "externalEvidence": false,
      "status": "PENDING",
      "evidence": {
        "path": "artifacts/phase5/formal/gates/G2-CLEAN-SOURCE.json",
        "sha256": null
      },
      "note": "Replace with the exact formal evidence path and digest; do not promote development smoke."
    },
    {
      "id": "G2-VERSION-TOOLCHAIN",
      "evidenceClass": "REPOSITORY",
      "externalEvidence": false,
      "status": "PENDING",
      "evidence": {
        "path": "artifacts/phase5/formal/gates/G2-VERSION-TOOLCHAIN.json",
        "sha256": null
      },
      "note": "Replace with the exact formal evidence path and digest; do not promote development smoke."
    },
    {
      "id": "WP1-METRICS-PRIVACY",
      "evidenceClass": "REPOSITORY",
      "externalEvidence": false,
      "status": "PENDING",
      "evidence": {
        "path": "artifacts/phase5/formal/gates/WP1-METRICS-PRIVACY.json",
        "sha256": null
      },
      "note": "Replace with the exact formal evidence path and digest; do not promote development smoke."
    },
    {
      "id": "WP2-BASELINE-REGRESSION",
      "evidenceClass": "FIXED_LAB",
      "externalEvidence": true,
      "status": "PENDING",
      "evidence": {
        "path": "artifacts/phase5/formal/gates/WP2-BASELINE-REGRESSION.json",
        "sha256": null
      },
      "note": "Replace with the exact formal evidence path and digest; do not promote development smoke."
    },
    {
      "id": "WP3-PERF-01",
      "evidenceClass": "FIXED_LAB",
      "externalEvidence": true,
      "status": "PENDING",
      "evidence": {
        "path": "artifacts/phase5/formal/gates/WP3-PERF-01.json",
        "sha256": null
      },
      "note": "Replace with the exact formal evidence path and digest; do not promote development smoke."
    },
    {
      "id": "WP3-PERF-02",
      "evidenceClass": "FIXED_LAB",
      "externalEvidence": true,
      "status": "PENDING",
      "evidence": {
        "path": "artifacts/phase5/formal/gates/WP3-PERF-02.json",
        "sha256": null
      },
      "note": "Replace with the exact formal evidence path and digest; do not promote development smoke."
    },
    {
      "id": "WP3-PERF-03",
      "evidenceClass": "FIXED_LAB",
      "externalEvidence": true,
      "status": "PENDING",
      "evidence": {
        "path": "artifacts/phase5/formal/gates/WP3-PERF-03.json",
        "sha256": null
      },
      "note": "Replace with the exact formal evidence path and digest; do not promote development smoke."
    },
    {
      "id": "WP3-PERF-04",
      "evidenceClass": "FIXED_LAB",
      "externalEvidence": true,
      "status": "PENDING",
      "evidence": {
        "path": "artifacts/phase5/formal/gates/WP3-PERF-04.json",
        "sha256": null
      },
      "note": "Replace with the exact formal evidence path and digest; do not promote development smoke."
    },
    {
      "id": "WP3-PERF-05",
      "evidenceClass": "FIXED_LAB",
      "externalEvidence": true,
      "status": "PENDING",
      "evidence": {
        "path": "artifacts/phase5/formal/gates/WP3-PERF-05.json",
        "sha256": null
      },
      "note": "Replace with the exact formal evidence path and digest; do not promote development smoke."
    },
    {
      "id": "WP3-PERF-06",
      "evidenceClass": "FIXED_LAB",
      "externalEvidence": true,
      "status": "PENDING",
      "evidence": {
        "path": "artifacts/phase5/formal/gates/WP3-PERF-06.json",
        "sha256": null
      },
      "note": "Replace with the exact formal evidence path and digest; do not promote development smoke."
    },
    {
      "id": "WP3-PERF-07",
      "evidenceClass": "FIXED_LAB",
      "externalEvidence": true,
      "status": "PENDING",
      "evidence": {
        "path": "artifacts/phase5/formal/gates/WP3-PERF-07.json",
        "sha256": null
      },
      "note": "Replace with the exact formal evidence path and digest; do not promote development smoke."
    },
    {
      "id": "WP3-PERF-08",
      "evidenceClass": "PROVIDER",
      "externalEvidence": true,
      "status": "PENDING",
      "evidence": {
        "path": "artifacts/phase5/formal/gates/WP3-PERF-08.json",
        "sha256": null
      },
      "note": "Replace with the exact formal evidence path and digest; do not promote development smoke."
    },
    {
      "id": "WP3-PERF-09",
      "evidenceClass": "FIXED_LAB",
      "externalEvidence": true,
      "status": "PENDING",
      "evidence": {
        "path": "artifacts/phase5/formal/gates/WP3-PERF-09.json",
        "sha256": null
      },
      "note": "Replace with the exact formal evidence path and digest; do not promote development smoke."
    },
    {
      "id": "WP4-RES-01",
      "evidenceClass": "FIXED_LAB",
      "externalEvidence": true,
      "status": "PENDING",
      "evidence": {
        "path": "artifacts/phase5/formal/gates/WP4-RES-01.json",
        "sha256": null
      },
      "note": "Replace with the exact formal evidence path and digest; do not promote development smoke."
    },
    {
      "id": "WP4-RES-02",
      "evidenceClass": "FIXED_LAB",
      "externalEvidence": true,
      "status": "PENDING",
      "evidence": {
        "path": "artifacts/phase5/formal/gates/WP4-RES-02.json",
        "sha256": null
      },
      "note": "Replace with the exact formal evidence path and digest; do not promote development smoke."
    },
    {
      "id": "WP4-RES-03",
      "evidenceClass": "FIXED_LAB",
      "externalEvidence": true,
      "status": "PENDING",
      "evidence": {
        "path": "artifacts/phase5/formal/gates/WP4-RES-03.json",
        "sha256": null
      },
      "note": "Replace with the exact formal evidence path and digest; do not promote development smoke."
    },
    {
      "id": "WP4-RES-04",
      "evidenceClass": "FIXED_LAB",
      "externalEvidence": true,
      "status": "PENDING",
      "evidence": {
        "path": "artifacts/phase5/formal/gates/WP4-RES-04.json",
        "sha256": null
      },
      "note": "Replace with the exact formal evidence path and digest; do not promote development smoke."
    },
    {
      "id": "WP4-RES-05",
      "evidenceClass": "FIXED_LAB",
      "externalEvidence": true,
      "status": "PENDING",
      "evidence": {
        "path": "artifacts/phase5/formal/gates/WP4-RES-05.json",
        "sha256": null
      },
      "note": "Replace with the exact formal evidence path and digest; do not promote development smoke."
    },
    {
      "id": "WP4-RES-06",
      "evidenceClass": "FIXED_LAB",
      "externalEvidence": true,
      "status": "PENDING",
      "evidence": {
        "path": "artifacts/phase5/formal/gates/WP4-RES-06.json",
        "sha256": null
      },
      "note": "Replace with the exact formal evidence path and digest; do not promote development smoke."
    },
    {
      "id": "WP4-LANE-A-8H",
      "evidenceClass": "FIXED_LAB",
      "externalEvidence": true,
      "status": "PENDING",
      "evidence": {
        "path": "artifacts/phase5/formal/gates/WP4-LANE-A-8H.json",
        "sha256": null
      },
      "note": "Replace with the exact formal evidence path and digest; do not promote development smoke."
    },
    {
      "id": "WP4-LANE-B-8H",
      "evidenceClass": "FIXED_LAB",
      "externalEvidence": true,
      "status": "PENDING",
      "evidence": {
        "path": "artifacts/phase5/formal/gates/WP4-LANE-B-8H.json",
        "sha256": null
      },
      "note": "Replace with the exact formal evidence path and digest; do not promote development smoke."
    },
    {
      "id": "WP4-FAULT-RECOVERY",
      "evidenceClass": "FIXED_LAB",
      "externalEvidence": true,
      "status": "PENDING",
      "evidence": {
        "path": "artifacts/phase5/formal/gates/WP4-FAULT-RECOVERY.json",
        "sha256": null
      },
      "note": "Replace with the exact formal evidence path and digest; do not promote development smoke."
    },
    {
      "id": "WP4-PRIVACY-CANARY",
      "evidenceClass": "FIXED_LAB",
      "externalEvidence": true,
      "status": "PENDING",
      "evidence": {
        "path": "artifacts/phase5/formal/gates/WP4-PRIVACY-CANARY.json",
        "sha256": null
      },
      "note": "Replace with the exact formal evidence path and digest; do not promote development smoke."
    },
    {
      "id": "WP5-PACKAGE-CONTENTS",
      "evidenceClass": "RELEASE",
      "externalEvidence": false,
      "status": "PENDING",
      "evidence": {
        "path": "artifacts/phase5/formal/gates/WP5-PACKAGE-CONTENTS.json",